<?xml version="1.0"?>
<CassandraTileStore xmlns="http://www.deegree.org/datasource/tile/cassandra" xmlns:md="http://www.deegree.org/metadata/spatial"
  xmlns:xsi="http://www.w3.org/2001/XMLSchema-instance"
  xsi:schemaLocation="http://www.deegree.org/datasource/tile/cassandra http://schemas.deegree.org/datasource/tile/filesystem/3.2.0/cassandra.xsd"
  configVersion="3.2.0">

  <TileDataSet>
    <Identifier>cassandra</Identifier>
    <TileMatrixSetId>inspirecrs84quad</TileMatrixSetId>
    <CassandraHosts>localhost:9160,otherhost:9160</CassandraHosts>
    <CassandraCluster>Test Cluster</CassandraCluster>
    <CassandraKeyspace>tilecache</CassandraKeyspace>
    <CassandraColumnfamily>tilecache</CassandraColumnfamily>
  </TileDataSet>

</CassandraTileStore>
